{
    "id": "video-wallpaper",
    "name": "Fondos animados",
    "description": "Backend de vídeo para WallpaperService (mpvpaper): reproduce mp4/webm/mkv/mov de la misma carpeta de fondos.",
    "version": "1.0.0",
    "author": "shinro",
    "type": "daemon",
    "capabilities": ["wallpaper-backend", "video-wallpaper-backend"],
    "extensions": ["mp4", "webm", "mkv", "mov"],
    "component": "./VideoDaemon.qml",
    "requires_shinro": ">=1.0",
    "permissions": []
}
